{"schema":"scene.v1","units":"mm","coordinateSystem":"right-handed-z-up","projectId":"fixture-bedroom","floorPlanVersionId":"plan-bedroom","floors":[{"id":"floor-1","name":"Ground","elevationMm":0,"heightMm":3000}],"spaces":[{"id":"space-bedroom","floorId":"floor-1","name":"Bedroom","type":"bedroom"}],"rooms":[{"id":"room-bedroom","spaceId":"space-bedroom","name":"Bedroom","type":"bedroom","boundary":[{"xMm":0,"yMm":0},{"xMm":4000,"yMm":0},{"xMm":4000,"yMm":3500},{"xMm":0,"yMm":3500},{"xMm":0,"yMm":0}],"confidence":1}],"walls":[{"id":"wall-bedroom","floorId":"floor-1","start":{"xMm":0,"yMm":0},"end":{"xMm":4000,"yMm":0},"thicknessMm":150,"heightMm":3000,"confidence":1}],"openings":[],"fixedFixtures":[],"modules":[{"id":"wardrobe-1","roomId":"room-bedroom","family":"wardrobe","widthMm":1800,"depthMm":650,"heightMm":2400,"position":{"xMm":500,"yMm":100},"rotationDeg":0,"anchor":"floor","confidence":1}],"materials":[],"lighting":[],"cameras":[],"constraints":[],"unresolvedDetections":[],"metadata":{"branch":"main","status":"approved","changeReason":"fixture","schemaVersion":"scene.v1","designVersion":"fixture-1"}}
