{"schema":"scene.v1","units":"mm","coordinateSystem":"right-handed-z-up","projectId":"fixture-kitchen","floorPlanVersionId":"plan-kitchen","floors":[{"id":"floor-1","name":"Ground","elevationMm":0,"heightMm":3000}],"spaces":[{"id":"space-kitchen","floorId":"floor-1","name":"Kitchen","type":"kitchen"}],"rooms":[{"id":"room-kitchen","spaceId":"space-kitchen","name":"Kitchen","type":"kitchen","boundary":[{"xMm":0,"yMm":0},{"xMm":3600,"yMm":0},{"xMm":3600,"yMm":2800},{"xMm":0,"yMm":2800},{"xMm":0,"yMm":0}],"confidence":1}],"walls":[{"id":"wall-kitchen","floorId":"floor-1","start":{"xMm":0,"yMm":0},"end":{"xMm":3600,"yMm":0},"thicknessMm":150,"heightMm":3000,"confidence":1}],"openings":[],"fixedFixtures":[],"modules":[{"id":"base-1","roomId":"room-kitchen","family":"kitchen-base","widthMm":600,"depthMm":600,"heightMm":850,"position":{"xMm":300,"yMm":100},"rotationDeg":0,"anchor":"floor","confidence":1}],"materials":[],"lighting":[],"cameras":[],"constraints":[],"unresolvedDetections":[],"metadata":{"branch":"main","status":"approved","changeReason":"fixture","schemaVersion":"scene.v1","designVersion":"fixture-1"}}
