{"schema":"scene.v1","units":"mm","coordinateSystem":"right-handed-z-up","projectId":"fixture-pooja","floorPlanVersionId":"plan-pooja","floors":[{"id":"floor-1","name":"Ground","elevationMm":0,"heightMm":3000}],"spaces":[{"id":"space-pooja","floorId":"floor-1","name":"Pooja","type":"pooja"}],"rooms":[{"id":"room-pooja","spaceId":"space-pooja","name":"Pooja Room","type":"pooja","boundary":[{"xMm":0,"yMm":0},{"xMm":1800,"yMm":0},{"xMm":1800,"yMm":1600},{"xMm":0,"yMm":1600},{"xMm":0,"yMm":0}],"confidence":1}],"walls":[{"id":"wall-pooja","floorId":"floor-1","start":{"xMm":0,"yMm":0},"end":{"xMm":1800,"yMm":0},"thicknessMm":150,"heightMm":3000,"confidence":1}],"openings":[],"fixedFixtures":[],"modules":[{"id":"altar-1","roomId":"room-pooja","family":"pooja-unit","widthMm":1200,"depthMm":450,"heightMm":2100,"position":{"xMm":300,"yMm":100},"rotationDeg":0,"anchor":"floor","confidence":1}],"materials":[],"lighting":[],"cameras":[],"constraints":[],"unresolvedDetections":[],"metadata":{"branch":"main","status":"approved","changeReason":"fixture","schemaVersion":"scene.v1","designVersion":"fixture-1"}}
