{"schema":"scene.v1","units":"mm","coordinateSystem":"right-handed-z-up","projectId":"fixture-living","floorPlanVersionId":"plan-living","floors":[{"id":"floor-1","name":"Ground","elevationMm":0,"heightMm":3000}],"spaces":[{"id":"space-living","floorId":"floor-1","name":"Living","type":"living"}],"rooms":[{"id":"room-living","spaceId":"space-living","name":"Living Room","type":"living","boundary":[{"xMm":0,"yMm":0},{"xMm":5000,"yMm":0},{"xMm":5000,"yMm":4000},{"xMm":0,"yMm":4000},{"xMm":0,"yMm":0}],"confidence":1}],"walls":[{"id":"wall-living","floorId":"floor-1","start":{"xMm":0,"yMm":0},"end":{"xMm":5000,"yMm":0},"thicknessMm":150,"heightMm":3000,"confidence":1}],"openings":[],"fixedFixtures":[],"modules":[{"id":"sofa-1","roomId":"room-living","family":"sofa","widthMm":2200,"depthMm":900,"heightMm":850,"position":{"xMm":1200,"yMm":1200},"rotationDeg":0,"anchor":"floor","confidence":1}],"materials":[],"lighting":[],"cameras":[],"constraints":[],"unresolvedDetections":[],"metadata":{"branch":"main","status":"approved","changeReason":"fixture","schemaVersion":"scene.v1","designVersion":"fixture-1"}}
